{
  "schema_version": "2.0",
  "result_id": "43d524f11e0cfeece80ceaca",
  "evidence_tier": "measured",
  "status": "complete",
  "renderer": {
    "id": "tcgs",
    "config_id": "tcgs",
    "name": "3DGSTensorCore / TC-GS (tcgs)",
    "version": "0.0.0",
    "source_uri": "https://github.com/DeepLink-org/3DGSTensorCore",
    "source_commit": "0bb82f88fde211c34b42e1497f0fc7265461592b",
    "build_command": "Use docker/tcgs.Dockerfile or clone the pinned repository and build the Speedy-Splat integration for the target SM architecture.",
    "runtime_command": "In-process adapter: src/renderers/tcgs_renderer.py",
    "api": "PyTorch CUDA extension",
    "backend": "CUDA Tensor Cores",
    "platforms": [
      "Linux",
      "Windows"
    ],
    "features": [
      "FP16 Tensor Core alpha evaluation"
    ]
  },
  "benchmark": {
    "suite_id": "3dgs-renderer-matrix",
    "suite_version": "3.1.0",
    "track_id": "common_representation",
    "case_id": "large-bicycle-1080p",
    "dataset_id": "mipnerf360",
    "dataset_sha256": "19fa7be077881cb614a87162aa49873b0e3a675bd89369d3598df1308a90f5c0",
    "scene_id": "bicycle",
    "scene_tier": "large",
    "checkpoint_sha256": "64d357cb25bd85f710f8551a18d830f8497277fbd8c5805adfd72ffe9ca78227",
    "gaussian_count": 6131954,
    "sh_degree": 3,
    "camera_trajectory_id": "large-bicycle-1080p-eval",
    "camera_trajectory_sha256": "58290b6f5d84f69659c53c76e9a9c005dfd94af83de93cd18800abbe14b10732",
    "quality_reference_sha256": "062de75381f5b0f0dafcca1ac884c68bd31366f4d9fe3c37797511f93a4deb7d",
    "resolution": {
      "width": 1920,
      "height": 1080
    },
    "color_space": "sRGB",
    "background": "black",
    "protocol_id": "matrix-primary-1080p-v2",
    "protocol_sha256": "892e18890501c408dc6746af69f17e16973604f0c02a3caddf1954d3bf1fede2"
  },
  "environment": {
    "hardware_profile_id": "202243ea1c238f9b",
    "gpu": "NVIDIA A100-SXM4-80GB",
    "gpu_uuid": "GPU-ab2c0112-a9c5-8a5e-90ed-a9145a7150a0",
    "gpu_vram_mb": 81152.8,
    "cpu": "x86_64",
    "ram_mb": 2063077.7,
    "os": "Linux-5.10.134-16.3.al8.x86_64-x86_64-with-glibc2.35",
    "driver": "580.105.08",
    "cuda": "12.8",
    "python": "3.10.20",
    "pytorch": "2.9.1+cu128",
    "benchmark_commit": "eb5217cb9d23f0a12a43632d625d614afae1d90f",
    "clock_policy": "default",
    "power_limit_w": 400.0
  },
  "metrics": {
    "performance": {
      "fps": 204.0441551551756,
      "fps_ci95_low": 155.12576721814145,
      "fps_ci95_high": 273.6574098176463,
      "frame_time_ms": 4.9009,
      "p95_frame_time_ms": 9.52,
      "p99_frame_time_ms": 14.45,
      "peak_vram_mb": 4308.0,
      "startup_time_ms": 2027.38,
      "renderer_init_time_ms": 0.04,
      "scene_load_time_ms": 7078.0,
      "renderer_prepare_time_ms": 44.5,
      "time_to_first_frame_ms": 6.03
    },
    "quality": {
      "psnr_db": 24.334905427839995,
      "ssim": 0.7895068806409836,
      "lpips": 0.30350847125053404
    },
    "raw_samples": {
      "uri": "results/measured/tcgs/mipnerf360/bicycle/20260805T141522Z/raw_samples.json",
      "sha256": "47d4a19dd2f2a54b47018cfb6e9e4a609a47cf051d82a8b2c12d617e194ce23c"
    }
  },
  "provenance": {
    "source_type": "repository_run",
    "source_uri": "results/measured/tcgs/mipnerf360/bicycle/20260805T141522Z",
    "measured_at": "2026-08-05T14:20:10.589048+00:00",
    "raw_samples_uri": "results/measured/tcgs/mipnerf360/bicycle/20260805T141522Z/raw_samples.json",
    "raw_samples_sha256": "47d4a19dd2f2a54b47018cfb6e9e4a609a47cf051d82a8b2c12d617e194ce23c",
    "deviations": []
  }
}
